{
  "$schema": "https://json-schema.org/draft/2020-12/schema",
  "type": "object",
  "required": [
    "_id",
    "direccion",
    "especialidad",
    "id_proveedor",
    "NIF",
    "nombre",
    "telefono"
  ],
  "properties": {
    "_id": {
      "$ref": "#/$defs/ObjectId"
    },
    "direccion": {
      "type": "string"
    },
    "especialidad": {
      "type": "string"
    },
    "fax": {
      "type": "string"
    },
    "id_proveedor": {
      "type": "integer"
    },
    "NIF": {
      "type": "string"
    },
    "nombre": {
      "type": "string"
    },
    "telefono": {
      "type": "string"
    }
  },
  "$defs": {
    "ObjectId": {
      "type": "object",
      "properties": {
        "$oid": {
          "type": "string",
          "pattern": "^[0-9a-fA-F]{24}$"
        }
      },
      "required": [
        "$oid"
      ],
      "additionalProperties": false
    }
  }
}